{
  "ledger_version": "AR-P003-v0.3-methodology-decisions-v0.1",
  "protocol_version": "v0.3-draft-2026-09-21-integrated-challenge-v0.1",
  "status": "development_unresolved",
  "decisions": [
    {
      "decision_id": "comparison_conditions",
      "title": "Comparison-condition design",
      "pre_freeze_required": true,
      "status": "selected",
      "current_implementation": "Selected three-condition development design: raw heterogeneous evidence only; neutral structured event table plus the same underlying evidence; Activity Receipt plus the same underlying evidence. Versioned implementation is required before the comparison-condition freeze gate is complete.",
      "selected_candidate": "three_condition_structured_control",
      "evidence_refs": [
        "docs/AR-P003-V0.3-COMPARISON-CONDITIONS-DECISION-2026-09-20.md",
        "benchmark/arp003_v0_3/methodology-impact-map.json",
        "docs/AR-P003-V0.3-DECISION-SUPPORT.md",
        "AI_Activity_Receipt_Research_and_v03_Protocol.pdf"
      ],
      "candidates": [
        {
          "candidate_id": "two_condition_current",
          "description": "Control = heterogeneous evidence only; Receipt = same evidence plus standardized Activity Receipt.",
          "source_class": "current_repository",
          "evidence_refs": [
            "benchmark/arp003_v0_3/protocol.json",
            "docs/AR-P003-V0.3-PROTOCOL.md"
          ]
        },
        {
          "candidate_id": "three_condition_structured_control",
          "description": "Raw evidence, neutral structured event table plus raw evidence, and Receipt plus raw evidence, allowing separation of generic evidence organization from Receipt-specific presentation.",
          "source_class": "project_research_review",
          "evidence_refs": [
            "AI_Activity_Receipt_Research_and_v03_Protocol.pdf"
          ]
        }
      ],
      "notes": "The earlier two-condition repository draft and the 2026-09-15 research-review recommendation remain preserved as conflicting historical inputs. The owner explicitly selected three_condition_structured_control on 2026-09-20; two_condition_current remains listed but is not selected.",
      "rationale": "Selected explicitly by the project owner to separate benefit from generic evidence organization/structuring from any additional benefit attributable specifically to the Activity Receipt presentation/semantic layer. The three conditions are raw heterogeneous evidence only; a neutral structured event table plus the same underlying evidence; and Activity Receipt plus the same underlying evidence."
    },
    {
      "decision_id": "primary_endpoint",
      "title": "Primary confirmatory endpoint",
      "pre_freeze_required": true,
      "status": "unresolved",
      "current_implementation": "Repository protocol reports prespecified component endpoints separately and explicitly has no post-hoc weighted composite primary score.",
      "selected_candidate": null,
      "evidence_refs": [
        "docs/AR-P003-V0.3-PROTOCOL.md",
        "benchmark/arp003_v0_3/response-record.schema.json"
      ],
      "candidates": [
        {
          "candidate_id": "component_endpoint_set",
          "description": "Prespecify a small primary set drawn from the existing action/source/incident F1 and categorical reconstruction endpoints, with timing reported separately.",
          "source_class": "current_repository",
          "evidence_refs": [
            "docs/AR-P003-V0.3-PROTOCOL.md"
          ]
        },
        {
          "candidate_id": "correct_completion_by_180s",
          "description": "Evidence-supported correct audit completion by 180 seconds: all required judgments correct with supported evidence and no fabricated material event/authorization; timeout cannot pass.",
          "source_class": "project_research_review",
          "evidence_refs": [
            "AI_Activity_Receipt_Research_and_v03_Protocol.pdf"
          ]
        }
      ],
      "notes": "The earlier research review proposed a single interpretable deadline-based primary endpoint; the current repository draft intentionally decomposes endpoints. A deliberate preregistration choice is still required."
    },
    {
      "decision_id": "primary_timing_clock",
      "title": "Primary timing definition",
      "pre_freeze_required": true,
      "status": "unresolved",
      "current_implementation": "Development runner records both wall and active elapsed time; page visibility automatically pauses active time and analysis requires an explicit active-vs-wall choice.",
      "selected_candidate": null,
      "evidence_refs": [
        "docs/AR-P003-V0.3-OFFLINE-RUNNER.md",
        "benchmark/arp003_v0_3/runner-response.schema.json"
      ],
      "candidates": [
        {
          "candidate_id": "active_time_primary",
          "description": "Use active time as primary timing measure, excluding explicit manual/visibility pause intervals under frozen rules.",
          "source_class": "current_repository",
          "evidence_refs": [
            "docs/AR-P003-V0.3-OFFLINE-RUNNER.md"
          ]
        },
        {
          "candidate_id": "wall_deadline_with_hidden_sensitivity",
          "description": "Include elapsed background/hidden time in the primary deadline and prespecify sensitivity analysis for trials with more than 10 seconds hidden rather than silently pausing selected trials.",
          "source_class": "project_research_review",
          "evidence_refs": [
            "AI_Activity_Receipt_Research_and_v03_Protocol.pdf"
          ]
        }
      ],
      "notes": "Instrumentation already preserves both clocks, so this decision can be frozen later without losing development observability. Do not select timing after confirmatory outcomes are visible."
    },
    {
      "decision_id": "challenge_design",
      "title": "Misleading-Receipt robustness design",
      "pre_freeze_required": true,
      "status": "selected",
      "current_implementation": "Selected integrated development architecture: ordinary, stale_receipt, incomplete_receipt, and conflicting_receipt cases remain inside the broader three-condition crossed assignment, with hidden stratum labels and separate ordinary/challenge reporting. Final challenge counts/allocation rules are not frozen.",
      "selected_candidate": "integrated_challenge_strata",
      "evidence_refs": [
        "docs/AR-P003-V0.3-CHALLENGE-DESIGN-DECISION-2026-09-21.md",
        "benchmark/arp003_v0_3/methodology-impact-map.json",
        "docs/AR-P003-V0.3-DECISION-SUPPORT.md",
        "docs/AR-P003-V0.3-PROTOCOL.md",
        "AI_Activity_Receipt_Research_and_v03_Protocol.pdf"
      ],
      "candidates": [
        {
          "candidate_id": "integrated_challenge_strata",
          "description": "Include prespecified stale/incomplete/conflicting Receipt strata within the broader balanced assignment and report ordinary/challenge results separately.",
          "source_class": "current_repository",
          "evidence_refs": [
            "docs/AR-P003-V0.3-PROTOCOL.md"
          ]
        },
        {
          "candidate_id": "separate_robustness_cohort",
          "description": "Use a distinct misleading-Receipt experiment/cohort with raw, faithful-Receipt, and corrupted-Receipt presentations as proposed in the research review.",
          "source_class": "project_research_review",
          "evidence_refs": [
            "AI_Activity_Receipt_Research_and_v03_Protocol.pdf"
          ]
        }
      ],
      "notes": "The current repository already implemented integrated stale/incomplete/conflicting strata, while the earlier project research review recommended a separate robustness cohort. The owner explicitly selected integrated_challenge_strata on 2026-09-21. separate_robustness_cohort remains preserved as the rejected historical alternative; final challenge counts/allocation and final-corpus review remain open.",
      "rationale": "Selected explicitly by the project owner to preserve stale, incomplete, and conflicting Receipt robustness questions inside the same crossed human-study architecture as ordinary cases, avoiding a separate recruitment/cohort/randomization/power framework while requiring ordinary and challenge results to remain separately reported."
    },
    {
      "decision_id": "reviewer_population",
      "title": "Target reviewer population and eligibility",
      "pre_freeze_required": true,
      "status": "unresolved",
      "current_implementation": "Protocol requires experience bands, language proficiency, project-familiarity rules, and exclusion of case constructors/scorers, but no target population is frozen.",
      "selected_candidate": null,
      "evidence_refs": [
        "docs/AR-P003-V0.3-PROTOCOL.md"
      ],
      "candidates": [
        {
          "candidate_id": "population_to_be_selected",
          "description": "Select a reviewer population whose recruitment matches the intended scope of any human-audit claim; preserve explicit eligibility/exclusion criteria.",
          "source_class": "future_decision",
          "evidence_refs": [
            "docs/AR-P003-V0.3-PROTOCOL.md"
          ]
        }
      ],
      "notes": "A convenience sample must not be generalized to a professional population without justification."
    },
    {
      "decision_id": "effect_precision_target",
      "title": "Minimally meaningful effect or precision target",
      "pre_freeze_required": true,
      "status": "unresolved",
      "current_implementation": "Independent-observation and crossed-design sensitivity tools exist, but their example effect/variance assumptions are explicitly illustrative.",
      "selected_candidate": null,
      "evidence_refs": [
        "docs/AR-P003-V0.3-PLANNING.md",
        "docs/AR-P003-V0.3-CROSSED-PLANNING.md"
      ],
      "candidates": [
        {
          "candidate_id": "effect_target_to_be_selected",